{
  "schema_version": "1.0",
  "generated_at": "2026-09-01",
  "source_file": "Plan-MAT1600-AB-A26 .pdf",
  "course": {
    "code": "MAT1600",
    "title": "Algèbre linéaire",
    "term": "A26",
    "institution": "Université de Montréal",
    "credits": 4,
    "instructor": "Zyed Ben Salah (section A), Karima Amoura (section B)",
    "language": "fr",
    "difficulty": 3,
    "effort_multiplier": 1.0,
    "sessions": []
  },
  "evaluations": [
    {
      "id": "MAT1600-QUIZ1",
      "title": "Quiz obligatoire 1",
      "type": "quiz",
      "weight": 5.0,
      "due_date": "2026-10-01",
      "due_time": null,
      "start_date": null,
      "duration_minutes": 30,
      "modality": null,
      "location": null,
      "cumulative": null,
      "group_work": null,
      "content_scope": [],
      "scope_units": null,
      "deliverable": null,
      "estimated_pages": null,
      "resources": ["David C. Lay, Algèbre linéaire et applications, 5e édition, Pearson, 2017 (manuel obligatoire)"],
      "notes": "Programmé en ligne sur Studium.",
      "confidence": "high",
      "source_excerpt": "Quiz obligatoire 1 (30 mn) 5% 1 octobre"
    },
    {
      "id": "MAT1600-INTRA",
      "title": "Intra",
      "type": "examen_intra",
      "weight": 35.0,
      "due_date": "2026-10-16",
      "due_time": null,
      "start_date": null,
      "duration_minutes": 110,
      "modality": "en_classe",
      "location": null,
      "cumulative": null,
      "group_work": null,
      "content_scope": [],
      "scope_units": null,
      "deliverable": null,
      "estimated_pages": null,
      "resources": ["David C. Lay, Algèbre linéaire et applications, 5e édition, Pearson, 2017 (manuel obligatoire)"],
      "notes": "Pas de reprise ; en cas d'absence motivée, la note du final est attribuée à l'intra manqué.",
      "confidence": "high",
      "source_excerpt": "Intra (1h50) 35% 16 octobre"
    },
    {
      "id": "MAT1600-QUIZ2",
      "title": "Quiz obligatoire 2",
      "type": "quiz",
      "weight": 5.0,
      "due_date": "2026-11-12",
      "due_time": null,
      "start_date": null,
      "duration_minutes": 30,
      "modality": null,
      "location": null,
      "cumulative": null,
      "group_work": null,
      "content_scope": [],
      "scope_units": null,
      "deliverable": null,
      "estimated_pages": null,
      "resources": ["David C. Lay, Algèbre linéaire et applications, 5e édition, Pearson, 2017 (manuel obligatoire)"],
      "notes": "Programmé en ligne sur Studium.",
      "confidence": "high",
      "source_excerpt": "Quiz obligatoire 2 (30 mn) 5% 12 novembre"
    },
    {
      "id": "MAT1600-FINAL",
      "title": "Final",
      "type": "examen_final",
      "weight": 55.0,
      "due_date": "2026-12-11",
      "due_time": null,
      "start_date": null,
      "duration_minutes": 170,
      "modality": "en_classe",
      "location": null,
      "cumulative": null,
      "group_work": null,
      "content_scope": [],
      "scope_units": null,
      "deliverable": null,
      "estimated_pages": null,
      "resources": ["David C. Lay, Algèbre linéaire et applications, 5e édition, Pearson, 2017 (manuel obligatoire)"],
      "notes": "Pour une absence motivée au final, un examen différé est tenu au début de la session suivante.",
      "confidence": "high",
      "source_excerpt": "Final (2h50) 55% 11 décembre"
    },
    {
      "id": "MAT1600-QUIZTP",
      "title": "Quiz-tps (11)",
      "type": "quiz",
      "weight": 0.0,
      "due_date": null,
      "due_time": null,
      "start_date": null,
      "duration_minutes": null,
      "modality": null,
      "location": null,
      "cumulative": null,
      "group_work": null,
      "content_scope": [],
      "scope_units": null,
      "deliverable": null,
      "estimated_pages": null,
      "resources": [],
      "notes": "Bonus de 4 % ajouté à la note finale (distinct des quiz obligatoires). 11 quiz-TP, dates sur Studium.",
      "confidence": "high",
      "source_excerpt": "Quiz-tps (11) +4% (Bonus) Voir Studium"
    }
  ],
  "totals": {
    "declared_weight_sum": 100.0,
    "evaluation_count": 5
  },
  "warnings": [
    "Les horaires des séances (cours théoriques le lundi, travaux pratiques le vendredi) ne précisent pas les heures : « L'horaire des séances… est disponible en tout temps dans votre centre étudiant. » Aucune session encodée.",
    "Les heures des évaluations (quiz, intra, final) ne sont pas précisées.",
    "Les dates des 11 quiz-TP bonus sont sur Studium : une seule entrée globale créée avec weight 0 (bonus +4 %).",
    "Charge de travail indiquée par le plan : 180 h au total (4 crédits × 45 h)."
  ]
}
