{
  "schema_version": "1.0",
  "generated_at": "2026-09-01",
  "source_file": "MAT1000_2026.pdf",
  "course": {
    "code": "MAT1000",
    "title": "Analyse 1",
    "term": "A26",
    "institution": null,
    "credits": null,
    "instructor": "Iosif Polterovich",
    "language": "fr",
    "difficulty": 3,
    "effort_multiplier": 1.0,
    "sessions": [
      {
        "kind": "cours",
        "weekday": "jeudi",
        "start": "10:30",
        "end": "12:30",
        "room": "B-0215 Pav. 3200 Jean-Brillant",
        "start_date": null,
        "end_date": null,
        "except_dates": []
      },
      {
        "kind": "cours",
        "weekday": "vendredi",
        "start": "12:30",
        "end": "14:30",
        "room": "Z-310 Pav. Claire Mc-Nicoll",
        "start_date": null,
        "end_date": null,
        "except_dates": []
      },
      {
        "kind": "tp",
        "weekday": "mercredi",
        "start": "08:30",
        "end": "10:30",
        "room": null,
        "start_date": null,
        "end_date": null,
        "except_dates": []
      }
    ]
  },
  "evaluations": [
    {
      "id": "MAT1000-Q1",
      "title": "Quiz 1",
      "type": "quiz",
      "weight": 5.0,
      "due_date": "2026-09-30",
      "due_time": null,
      "start_date": null,
      "duration_minutes": null,
      "modality": null,
      "location": null,
      "cumulative": null,
      "group_work": null,
      "content_scope": [],
      "scope_units": null,
      "deliverable": null,
      "estimated_pages": null,
      "resources": [],
      "notes": "Date préliminaire. Pondération de 10 % pour l'ensemble des deux quiz, répartie également (déduction).",
      "confidence": "low",
      "source_excerpt": "Quiz: 30 septembre et 18 novembre (dates préliminaires)."
    },
    {
      "id": "MAT1000-Q2",
      "title": "Quiz 2",
      "type": "quiz",
      "weight": 5.0,
      "due_date": "2026-11-18",
      "due_time": null,
      "start_date": null,
      "duration_minutes": null,
      "modality": null,
      "location": null,
      "cumulative": null,
      "group_work": null,
      "content_scope": [],
      "scope_units": null,
      "deliverable": null,
      "estimated_pages": null,
      "resources": [],
      "notes": "Date préliminaire. Pondération de 10 % pour l'ensemble des deux quiz, répartie également (déduction).",
      "confidence": "low",
      "source_excerpt": "Quiz: 30 septembre et 18 novembre (dates préliminaires)."
    },
    {
      "id": "MAT1000-INTRA",
      "title": "Intra",
      "type": "examen_intra",
      "weight": 40.0,
      "due_date": "2026-10-14",
      "due_time": "08:30",
      "start_date": null,
      "duration_minutes": 120,
      "modality": "en_classe",
      "location": "B-2325 Pav. Jean-Brillant",
      "cumulative": null,
      "group_work": null,
      "content_scope": [],
      "scope_units": null,
      "deliverable": null,
      "estimated_pages": null,
      "resources": ["J. Labelle et A. Mercier, Introduction à l'analyse réelle, Modulo, Mont-Royal, 1993 (manuel obligatoire)"],
      "notes": null,
      "confidence": "high",
      "source_excerpt": "Intra: mercredi 14 octobre, 8h30–10h30, B-2325 Pav. Jean-Brillant."
    },
    {
      "id": "MAT1000-FINAL",
      "title": "Final",
      "type": "examen_final",
      "weight": 50.0,
      "due_date": "2026-12-10",
      "due_time": "12:30",
      "start_date": null,
      "duration_minutes": 180,
      "modality": "en_classe",
      "location": "1140 Pav. André-Aisenstadt",
      "cumulative": null,
      "group_work": null,
      "content_scope": [],
      "scope_units": null,
      "deliverable": null,
      "estimated_pages": null,
      "resources": ["J. Labelle et A. Mercier, Introduction à l'analyse réelle, Modulo, Mont-Royal, 1993 (manuel obligatoire)"],
      "notes": null,
      "confidence": "high",
      "source_excerpt": "Final: jeudi 10 décembre, 12h30–15h30, 1140 Pav. André-Aisenstadt."
    }
  ],
  "totals": {
    "declared_weight_sum": 100.0,
    "evaluation_count": 4
  },
  "warnings": [
    "Le nombre de crédits n'est pas mentionné dans le plan de cours.",
    "La pondération individuelle des quiz n'est pas précisée : « Quiz 10 % » réparti également entre les deux quiz (5 % chacun, déduction).",
    "Les dates des quiz sont qualifiées de préliminaires dans le plan de cours.",
    "La matière couverte par l'intra et le final n'est pas précisée.",
    "Les dates de début et de fin des séances hebdomadaires ne sont pas précisées.",
    "L'heure et la durée des quiz ne sont pas précisées (les TP ont lieu le mercredi 8h30–10h30, mais le plan ne dit pas que les quiz s'y tiennent)."
  ]
}
